{
  "claims": [
    {
      "claim_id": "CN29-2026-W42-WEEKLY_ETHBTC",
      "declared_state": "ABSTAIN",
      "evaluation_end_utc": "2026-10-19T07:00:00Z",
      "evaluation_start_utc": "2026-10-12T07:00:00Z",
      "family": "DIRECTION_ROTATION_CLAIMS",
      "forecast_week": "2026-W42",
      "issued_at_utc": "2026-10-12T06:32:25Z",
      "kind": "METRIC_COMPARISON",
      "metric_source_id": "CN_WEEKLY_ANALYSIS_ONLY_v1",
      "public_issue_number": 29,
      "source_sha256": "b9415148ff1a2eb3898f4167cd3a1eb4d5d07bbd16dfdad5aadf48a2b0df1896",
      "statement_da": "ETH/BTC: se kildens frosne ugeudsagn.",
      "statement_en": "W42 ETH/BTC recovery is unconfirmed; no directional weekly-close condition is frozen."
    },
    {
      "claim_id": "CN29-2026-W42-WEEKLY_BREADTH",
      "declared_state": "ABSTAIN",
      "evaluation_end_utc": "2026-10-19T07:00:00Z",
      "evaluation_start_utc": "2026-10-12T07:00:00Z",
      "family": "DIRECTION_ROTATION_CLAIMS",
      "forecast_week": "2026-W42",
      "issued_at_utc": "2026-10-12T06:32:25Z",
      "kind": "METRIC_COMPARISON",
      "metric_source_id": "CN_WEEKLY_ANALYSIS_ONLY_v1",
      "public_issue_number": 29,
      "source_sha256": "b9415148ff1a2eb3898f4167cd3a1eb4d5d07bbd16dfdad5aadf48a2b0df1896",
      "statement_da": "Bredde: se kildens frosne ugeudsagn.",
      "statement_en": "Broad rotation remains unconfirmed for W42 unless short-window alt participation recovers and longer-window breadth strengthens together; no capitalization-tier handoff is assumed."
    },
    {
      "claim_id": "CN29-2026-W42-WEEKLY_REGIME",
      "declared_state": "ABSTAIN",
      "evaluation_end_utc": "2026-10-19T07:00:00Z",
      "evaluation_start_utc": "2026-10-12T07:00:00Z",
      "family": "DIRECTION_ROTATION_CLAIMS",
      "forecast_week": "2026-W42",
      "issued_at_utc": "2026-10-12T06:32:25Z",
      "kind": "METRIC_COMPARISON",
      "metric_source_id": "CN_WEEKLY_ANALYSIS_ONLY_v1",
      "public_issue_number": 29,
      "source_sha256": "b9415148ff1a2eb3898f4167cd3a1eb4d5d07bbd16dfdad5aadf48a2b0df1896",
      "statement_da": "Regime: se kildens frosne ugeudsagn.",
      "statement_en": "REGIME_RESILIENCE: W42 has recovery and retest possibilities, without assuming confirmed expansion or breakdown."
    },
    {
      "claim_id": "CN29-2026-W42-WEEKLY_ROTATION",
      "declared_state": "ABSTAIN",
      "evaluation_end_utc": "2026-10-19T07:00:00Z",
      "evaluation_start_utc": "2026-10-12T07:00:00Z",
      "family": "DIRECTION_ROTATION_CLAIMS",
      "forecast_week": "2026-W42",
      "issued_at_utc": "2026-10-12T06:32:25Z",
      "kind": "METRIC_COMPARISON",
      "metric_source_id": "CN_WEEKLY_ANALYSIS_ONLY_v1",
      "public_issue_number": 29,
      "source_sha256": "b9415148ff1a2eb3898f4167cd3a1eb4d5d07bbd16dfdad5aadf48a2b0df1896",
      "statement_da": "Rotation: se kildens frosne ugeudsagn.",
      "statement_en": "ROTATION_TRANSMISSION: Durable full-ladder alt transmission is not assumed."
    },
    {
      "claim_id": "CN29-2026-W42-WEEKLY_FLOW",
      "declared_state": "ABSTAIN",
      "evaluation_end_utc": "2026-10-19T07:00:00Z",
      "evaluation_start_utc": "2026-10-12T07:00:00Z",
      "family": "DIRECTION_ROTATION_CLAIMS",
      "forecast_week": "2026-W42",
      "issued_at_utc": "2026-10-12T06:32:25Z",
      "kind": "METRIC_COMPARISON",
      "metric_source_id": "CN_WEEKLY_ANALYSIS_ONLY_v1",
      "public_issue_number": 29,
      "source_sha256": "b9415148ff1a2eb3898f4167cd3a1eb4d5d07bbd16dfdad5aadf48a2b0df1896",
      "statement_da": "Flow: se kildens frosne ugeudsagn.",
      "statement_en": "FLOW_QUALITY_FRAGILITY: Assess price resilience against settled flows, relative strength, breadth and available microstructure; do not infer disabled direct spot confirmation or distribution."
    },
    {
      "claim_id": "CN29-2026-W42-DIRECTION_14D",
      "declared_state": "ABSTAIN",
      "evaluation_end_utc": "2026-10-26T07:00:00Z",
      "evaluation_start_utc": "2026-10-12T07:00:00Z",
      "family": "DIRECTION_ROTATION_CLAIMS",
      "forecast_week": "2026-W42",
      "issued_at_utc": "2026-10-12T06:32:25Z",
      "kind": "METRIC_COMPARISON",
      "metric_source_id": "CN_WEEKLY_ANALYSIS_ONLY_v1",
      "public_issue_number": 29,
      "source_sha256": "b9415148ff1a2eb3898f4167cd3a1eb4d5d07bbd16dfdad5aadf48a2b0df1896",
      "statement_da": "To-ugers retning: kildeanalyse, endnu ikke objektiv binær prognose.",
      "statement_en": "MIXED: selective recovery attempts and renewed weakness both remain credible. ETH/BTC has fallen, short-window alt participation faded, and longer-window breadth has not confirmed a broad rotation. The late recovery does not establish a sustained decline either."
    },
    {
      "claim_id": "CN29-2026-W42-DIRECTION_21D",
      "declared_state": "ABSTAIN",
      "evaluation_end_utc": "2026-11-02T07:00:00Z",
      "evaluation_start_utc": "2026-10-12T07:00:00Z",
      "family": "DIRECTION_ROTATION_CLAIMS",
      "forecast_week": "2026-W42",
      "issued_at_utc": "2026-10-12T06:32:25Z",
      "kind": "METRIC_COMPARISON",
      "metric_source_id": "CN_WEEKLY_ANALYSIS_ONLY_v1",
      "public_issue_number": 29,
      "source_sha256": "b9415148ff1a2eb3898f4167cd3a1eb4d5d07bbd16dfdad5aadf48a2b0df1896",
      "statement_da": "Tre-ugers retning: kildeanalyse, endnu ikke objektiv binær prognose.",
      "statement_en": "MIXED: selective recovery attempts and renewed weakness both remain credible. ETH/BTC has fallen, short-window alt participation faded, and longer-window breadth has not confirmed a broad rotation. The late recovery does not establish a sustained decline either."
    },
    {
      "claim_id": "CN29-2026-W42-DIRECTION_28D",
      "declared_state": "ABSTAIN",
      "evaluation_end_utc": "2026-11-09T07:00:00Z",
      "evaluation_start_utc": "2026-10-12T07:00:00Z",
      "family": "DIRECTION_ROTATION_CLAIMS",
      "forecast_week": "2026-W42",
      "issued_at_utc": "2026-10-12T06:32:25Z",
      "kind": "METRIC_COMPARISON",
      "metric_source_id": "CN_WEEKLY_ANALYSIS_ONLY_v1",
      "public_issue_number": 29,
      "source_sha256": "b9415148ff1a2eb3898f4167cd3a1eb4d5d07bbd16dfdad5aadf48a2b0df1896",
      "statement_da": "Fire-ugers retning: kildeanalyse, endnu ikke objektiv binær prognose.",
      "statement_en": "UNAVAILABLE cycle direction and UNAVAILABLE action posture. The longer shadow window is ready as context, but it does not establish a stable phase or an evidence-supported forward cycle call."
    },
    {
      "claim_id": "CN29-2026-W42-DIRECTION_56D",
      "declared_state": "ABSTAIN",
      "evaluation_end_utc": "2026-12-07T07:00:00Z",
      "evaluation_start_utc": "2026-10-12T07:00:00Z",
      "family": "DIRECTION_ROTATION_CLAIMS",
      "forecast_week": "2026-W42",
      "issued_at_utc": "2026-10-12T06:32:25Z",
      "kind": "METRIC_COMPARISON",
      "metric_source_id": "CN_WEEKLY_ANALYSIS_ONLY_v1",
      "public_issue_number": 29,
      "source_sha256": "b9415148ff1a2eb3898f4167cd3a1eb4d5d07bbd16dfdad5aadf48a2b0df1896",
      "statement_da": "Otte-ugers retning: kildeanalyse, endnu ikke objektiv binær prognose.",
      "statement_en": "UNAVAILABLE cycle direction and UNAVAILABLE action posture. The longer shadow window is ready as context, but it does not establish a stable phase or an evidence-supported forward cycle call."
    },
    {
      "claim_id": "CN29-2026-W42-PB24H",
      "declared_state": "ABSTAIN",
      "evaluation_end_utc": "2026-10-13T07:00:00Z",
      "evaluation_start_utc": "2026-10-12T07:00:00Z",
      "family": "PULLBACK_EDGE",
      "forecast_week": "2026-W42",
      "issued_at_utc": "2026-10-12T06:32:25Z",
      "kind": "EVENT_OCCURRENCE",
      "metric_source_id": "BTC_USD_HOURLY_V1",
      "public_issue_number": 29,
      "source_sha256": "b9415148ff1a2eb3898f4167cd3a1eb4d5d07bbd16dfdad5aadf48a2b0df1896",
      "statement_da": "Pullback-risiko er observeret, men et numerisk 24-timers udsagn er ikke givet.",
      "statement_en": "Risk tracker observed, but no material 24-hour drawdown prediction is made."
    }
  ],
  "contract": "CN_V2_FROZEN_CLAIMS_v1",
  "forecast_week": "2026-W42",
  "issued_at_utc": "2026-10-12T06:32:25Z",
  "public_issue_number": 29,
  "scoring_contract": "CN_EDGE_BINARY_v2_0",
  "source_sha256": "b9415148ff1a2eb3898f4167cd3a1eb4d5d07bbd16dfdad5aadf48a2b0df1896"
}
