{
  "claims": [
    {
      "claim_id": "CN30-2026-W43-WEEKLY_ETHBTC",
      "declared_state": "ABSTAIN",
      "evaluation_end_utc": "2026-10-26T06:00:00Z",
      "evaluation_start_utc": "2026-10-19T06:00:00Z",
      "family": "DIRECTION_ROTATION_CLAIMS",
      "forecast_week": "2026-W43",
      "issued_at_utc": "2026-10-19T05:19:14Z",
      "kind": "METRIC_COMPARISON",
      "metric_source_id": "CN_WEEKLY_ANALYSIS_ONLY_v1",
      "public_issue_number": 30,
      "source_sha256": "30266438be4a3db81a317db9a65da1283a63c6215c87f8678872db4e6b8e4e43",
      "statement_da": "ETH/BTC: se kildens frosne ugeudsagn.",
      "statement_en": "ETH-relative stabilization remains unconfirmed; no W43 weekly-close direction is frozen."
    },
    {
      "claim_id": "CN30-2026-W43-WEEKLY_BREADTH",
      "declared_state": "ABSTAIN",
      "evaluation_end_utc": "2026-10-26T06:00:00Z",
      "evaluation_start_utc": "2026-10-19T06:00:00Z",
      "family": "DIRECTION_ROTATION_CLAIMS",
      "forecast_week": "2026-W43",
      "issued_at_utc": "2026-10-19T05:19:14Z",
      "kind": "METRIC_COMPARISON",
      "metric_source_id": "CN_WEEKLY_ANALYSIS_ONLY_v1",
      "public_issue_number": 30,
      "source_sha256": "30266438be4a3db81a317db9a65da1283a63c6215c87f8678872db4e6b8e4e43",
      "statement_da": "Bredde: se kildens frosne ugeudsagn.",
      "statement_en": "Broad rotation remains unconfirmed without persistent short-window breadth and stronger longer-window participation."
    },
    {
      "claim_id": "CN30-2026-W43-WEEKLY_REGIME",
      "declared_state": "ABSTAIN",
      "evaluation_end_utc": "2026-10-26T06:00:00Z",
      "evaluation_start_utc": "2026-10-19T06:00:00Z",
      "family": "DIRECTION_ROTATION_CLAIMS",
      "forecast_week": "2026-W43",
      "issued_at_utc": "2026-10-19T05:19:14Z",
      "kind": "METRIC_COMPARISON",
      "metric_source_id": "CN_WEEKLY_ANALYSIS_ONLY_v1",
      "public_issue_number": 30,
      "source_sha256": "30266438be4a3db81a317db9a65da1283a63c6215c87f8678872db4e6b8e4e43",
      "statement_da": "Regime: se kildens frosne ugeudsagn.",
      "statement_en": "REGIME_RESILIENCE: Test recovery durability against renewed retest risk without presuming uninterrupted decline or confirmed expansion."
    },
    {
      "claim_id": "CN30-2026-W43-WEEKLY_ROTATION",
      "declared_state": "ABSTAIN",
      "evaluation_end_utc": "2026-10-26T06:00:00Z",
      "evaluation_start_utc": "2026-10-19T06:00:00Z",
      "family": "DIRECTION_ROTATION_CLAIMS",
      "forecast_week": "2026-W43",
      "issued_at_utc": "2026-10-19T05:19:14Z",
      "kind": "METRIC_COMPARISON",
      "metric_source_id": "CN_WEEKLY_ANALYSIS_ONLY_v1",
      "public_issue_number": 30,
      "source_sha256": "30266438be4a3db81a317db9a65da1283a63c6215c87f8678872db4e6b8e4e43",
      "statement_da": "Rotation: se kildens frosne ugeudsagn.",
      "statement_en": "ROTATION_TRANSMISSION: Do not assume a durable full-ladder handoff without independent tier evidence."
    },
    {
      "claim_id": "CN30-2026-W43-WEEKLY_FLOW",
      "declared_state": "ABSTAIN",
      "evaluation_end_utc": "2026-10-26T06:00:00Z",
      "evaluation_start_utc": "2026-10-19T06:00:00Z",
      "family": "DIRECTION_ROTATION_CLAIMS",
      "forecast_week": "2026-W43",
      "issued_at_utc": "2026-10-19T05:19:14Z",
      "kind": "METRIC_COMPARISON",
      "metric_source_id": "CN_WEEKLY_ANALYSIS_ONLY_v1",
      "public_issue_number": 30,
      "source_sha256": "30266438be4a3db81a317db9a65da1283a63c6215c87f8678872db4e6b8e4e43",
      "statement_da": "Flow: se kildens frosne ugeudsagn.",
      "statement_en": "FLOW_QUALITY_FRAGILITY: Weigh price rebounds against settled flows, relative strength, breadth and available microstructure without inferring disabled direct spot confirmation, directional sentiment or distribution."
    },
    {
      "claim_id": "CN30-2026-W43-DIRECTION_14D",
      "declared_state": "ABSTAIN",
      "evaluation_end_utc": "2026-11-02T06:00:00Z",
      "evaluation_start_utc": "2026-10-19T06:00:00Z",
      "family": "DIRECTION_ROTATION_CLAIMS",
      "forecast_week": "2026-W43",
      "issued_at_utc": "2026-10-19T05:19:14Z",
      "kind": "METRIC_COMPARISON",
      "metric_source_id": "CN_WEEKLY_ANALYSIS_ONLY_v1",
      "public_issue_number": 30,
      "source_sha256": "30266438be4a3db81a317db9a65da1283a63c6215c87f8678872db4e6b8e4e43",
      "statement_da": "To-ugers retning: kildeanalyse, endnu ikke objektiv binær prognose.",
      "statement_en": "MIXED with retest risk: BTC rebound potential competes with weaker ETH/BTC, shrinking short-window breadth and negative settled flows; neither persistent expansion nor uninterrupted decline is established."
    },
    {
      "claim_id": "CN30-2026-W43-DIRECTION_21D",
      "declared_state": "ABSTAIN",
      "evaluation_end_utc": "2026-11-09T06:00:00Z",
      "evaluation_start_utc": "2026-10-19T06:00:00Z",
      "family": "DIRECTION_ROTATION_CLAIMS",
      "forecast_week": "2026-W43",
      "issued_at_utc": "2026-10-19T05:19:14Z",
      "kind": "METRIC_COMPARISON",
      "metric_source_id": "CN_WEEKLY_ANALYSIS_ONLY_v1",
      "public_issue_number": 30,
      "source_sha256": "30266438be4a3db81a317db9a65da1283a63c6215c87f8678872db4e6b8e4e43",
      "statement_da": "Tre-ugers retning: kildeanalyse, endnu ikke objektiv binær prognose.",
      "statement_en": "MIXED with retest risk: BTC rebound potential competes with weaker ETH/BTC, shrinking short-window breadth and negative settled flows; neither persistent expansion nor uninterrupted decline is established."
    },
    {
      "claim_id": "CN30-2026-W43-DIRECTION_28D",
      "declared_state": "ABSTAIN",
      "evaluation_end_utc": "2026-11-16T06:00:00Z",
      "evaluation_start_utc": "2026-10-19T06:00:00Z",
      "family": "DIRECTION_ROTATION_CLAIMS",
      "forecast_week": "2026-W43",
      "issued_at_utc": "2026-10-19T05:19:14Z",
      "kind": "METRIC_COMPARISON",
      "metric_source_id": "CN_WEEKLY_ANALYSIS_ONLY_v1",
      "public_issue_number": 30,
      "source_sha256": "30266438be4a3db81a317db9a65da1283a63c6215c87f8678872db4e6b8e4e43",
      "statement_da": "Fire-ugers retning: kildeanalyse, endnu ikke objektiv binær prognose.",
      "statement_en": "UNAVAILABLE cycle direction and UNAVAILABLE action posture: longer shadow context is ready, but no stable phase or supported forward cycle path is established."
    },
    {
      "claim_id": "CN30-2026-W43-DIRECTION_56D",
      "declared_state": "ABSTAIN",
      "evaluation_end_utc": "2026-12-14T06:00:00Z",
      "evaluation_start_utc": "2026-10-19T06:00:00Z",
      "family": "DIRECTION_ROTATION_CLAIMS",
      "forecast_week": "2026-W43",
      "issued_at_utc": "2026-10-19T05:19:14Z",
      "kind": "METRIC_COMPARISON",
      "metric_source_id": "CN_WEEKLY_ANALYSIS_ONLY_v1",
      "public_issue_number": 30,
      "source_sha256": "30266438be4a3db81a317db9a65da1283a63c6215c87f8678872db4e6b8e4e43",
      "statement_da": "Otte-ugers retning: kildeanalyse, endnu ikke objektiv binær prognose.",
      "statement_en": "UNAVAILABLE cycle direction and UNAVAILABLE action posture: longer shadow context is ready, but no stable phase or supported forward cycle path is established."
    },
    {
      "claim_id": "CN30-2026-W43-PB24H",
      "declared_state": "ABSTAIN",
      "evaluation_end_utc": "2026-10-20T06:00:00Z",
      "evaluation_start_utc": "2026-10-19T06:00:00Z",
      "family": "PULLBACK_EDGE",
      "forecast_week": "2026-W43",
      "issued_at_utc": "2026-10-19T05:19:14Z",
      "kind": "EVENT_OCCURRENCE",
      "metric_source_id": "BTC_USD_HOURLY_V1",
      "public_issue_number": 30,
      "source_sha256": "30266438be4a3db81a317db9a65da1283a63c6215c87f8678872db4e6b8e4e43",
      "statement_da": "Pullback-risiko er observeret, men et numerisk 24-timers udsagn er ikke givet.",
      "statement_en": "Risk tracker observed, but no material 24-hour drawdown prediction is made."
    }
  ],
  "contract": "CN_V2_FROZEN_CLAIMS_v1",
  "forecast_week": "2026-W43",
  "issued_at_utc": "2026-10-19T05:19:14Z",
  "public_issue_number": 30,
  "scoring_contract": "CN_EDGE_BINARY_v2_0",
  "source_sha256": "30266438be4a3db81a317db9a65da1283a63c6215c87f8678872db4e6b8e4e43"
}
